{
  "contract": "PilotDeviceBinding",
  "contract_version": "0.2.0-draft.1",
  "record_id": "fixture:binding-b",
  "revision": 2,
  "issued_at": "2026-09-23T12:10:00Z",
  "authority_id": "fixture-inventory-authority",
  "tenant_id": "fixture-tenant",
  "security_domain_id": "pilot-fixture",
  "correlation_id": "fixture:binding-b",
  "logical_device_id": "fixture-logical-b",
  "instance_id": "fixture-instance-b",
  "storage_generation": 1,
  "bootstrap_identity_ref": {
    "uri": "urn:kaiba:fixture:identity-b",
    "digest": "sha256:cfc6a6cd32958c13474f11120db022e87fd2f8cbd57d164a6537a9f5c489bfe8"
  },
  "credential": {
    "slot": "slot-management",
    "role": "pilot_management",
    "key_generation": 1,
    "spki_digest": "sha256:5c311cf3551642e7cde630c4e54ea5d963894eb7a10bf4a215f1dd2e4dd0b9e8",
    "issuer_id": "fixture-pilot-issuer",
    "certificate_serial": "b1",
    "not_before": "2026-09-23T12:00:00Z",
    "not_after": "2026-09-23T13:00:00Z"
  },
  "state": "active",
  "target": {
    "asset_ref": "fixture-device-b",
    "identity_ref": {
      "uri": "urn:kaiba:fixture:identity-b",
      "digest": "sha256:cfc6a6cd32958c13474f11120db022e87fd2f8cbd57d164a6537a9f5c489bfe8"
    },
    "storage_ref": {
      "uri": "urn:kaiba:fixture:storage-b",
      "digest": "sha256:57e7f46e53ae78597fdf4ae40c816dc80a7934c95c5bc705805b44bc4a86a9e2"
    }
  },
  "adoption_ref": {
    "record_id": "fixture:adoption-b",
    "revision": 1,
    "digest": "sha256:394496209a3e5e241e4d806cdeb8e625d5c25c0d7f85a45a471fa9a6ea18e7d7"
  },
  "policy_ref": {
    "record_id": "fixture:pilot-policy",
    "revision": 1,
    "digest": "sha256:7067b03ef57a1dc903b99a4aebf4dfe67743bec70434f767167d63ee144e912e"
  },
  "admission_ref": {
    "record_id": "fixture:decision-b",
    "revision": 1,
    "digest": "sha256:e0006754c74063c0125b64f918cbc0f89ec2813f95e931d87b0a0a597d86c4bd"
  },
  "audience": "fixture-pilot-audience",
  "profile": "rpi5-existing-luks-pilot-v1",
  "permissions": [
    "pilot:self:read",
    "pilot:diagnostic-reference:submit"
  ],
  "full_qualification": false,
  "activation": {
    "activated_at": "2026-09-23T12:10:00Z",
    "verifier_receipt_ref": {
      "uri": "urn:kaiba:fixture:installed-key-proof-b",
      "digest": "sha256:6ca02a036f801d20e3157b3270645e29fe558b7b17f14b931fbde8522c9500a2"
    },
    "policy_ref": {
      "record_id": "fixture:pilot-policy",
      "revision": 1,
      "digest": "sha256:7067b03ef57a1dc903b99a4aebf4dfe67743bec70434f767167d63ee144e912e"
    },
    "restart_kind": "client_process"
  }
}
